{
  "schema_version": 1,
  "spec_revision": 1,
  "plan_revision": 1,
  "verdict": "advice",
  "reviewed_artifacts": [
    "spec.md",
    "research.md",
    "plan.md"
  ],
  "artifact_digests": {
    "spec.md": "56b8d102612722343ba6c9f5f550c2df60022863f7d558e6f0a6deb543bc124c",
    "research.md": "1eb5868e15f8340cffd003a41f9559c5cdda2703d1ae96acb1967ae08b2686af",
    "plan.md": "0e7a11a0f5b9c6ed26b52149aada6168c3a68410e6cc15c34b3da2a414c77f42"
  },
  "out_of_scope_disposition": "none"
}
